Greet,Hi there!
Greet,Good morning!
Greet,"Hey, how's it going?"
Greet,"Hello, nice to meet you!"
Greet,Greetings!
Greet,"Hey, what's up?"
Greet,"Morning, how are you?"
Greet,"Hi, how can I help?"
Greet,"Hello, how's your day?"
Greet,"Hey, long time no see!"
Greet,"Good afternoon, how's everything?"
Greet,"Hi, nice to see you again!"
Greet,"Hello, how's the family?"
Greet,"Hey, hope you're doing well!"
Greet,"Hi, it's a beautiful day, isn't it?"
Greet,"Hello, what's new with you?"
Greet,"Hey there, ready for the day?"
Greet,"Yo, what's happening?"
Greet,"Hi, how's work going?"
Greet,"Hello, how was your weekend?"
Greet,"Hey, what's the latest news?"
Greet,"Hi, how's the project coming along?"
Greet,"Hello, any plans for the evening?"
Greet,"Hey, how's the weather treating you?"
Greet,"Hi, how's the family doing?"
Greet,"Hello, what's on your mind?"
Greet,"Hey there, what's cooking?"
Greet,"Hi, anything exciting happening?"
Greet,"Hello, how's life treating you?"
Greet,"Hey, what's the buzz?"
Farewell,Goodbye for now.
Farewell,Take care!
Farewell,"See you later, alligator!"
Farewell,Bye for now!
Farewell,"Farewell, my friend!"
Farewell,Have a great day!
Farewell,Until we meet again!
Farewell,Goodnight and sleep well!
Farewell,See you around!
Farewell,Take it easy!
Farewell,"Bye, have a safe journey!"
Farewell,"Goodbye, it was nice talking to you!"
Farewell,Catch you later!
Farewell,"Farewell, until next time!"
Farewell,"See you soon, I hope!"
Farewell,"Goodbye, stay safe!"
Farewell,"Bye, take care of yourself!"
Farewell,"Until next time, goodbye!"
Farewell,Have a wonderful day ahead!
Farewell,"Goodbye, thanks for everything!"
Farewell,"Take care, see you tomorrow!"
Farewell,"Farewell, have a blessed day!"
Farewell,"See you later, take care!"
Farewell,"Goodbye, keep in touch!"
Farewell,"Bye, see you next week!"
Farewell,"Farewell, God bless you!"
Farewell,"Take care, talk to you soon!"
Inquiry,What time is the meeting?
Inquiry,Could you tell me where the nearest coffee shop is?
Inquiry,Do you know when the next bus arrives?
Inquiry,Where can I find the restroom?
Inquiry,What's on the agenda for today?
Inquiry,Can you help me with this problem?
Inquiry,Do you have information about local events?
Inquiry,Could you provide directions to the museum?
Inquiry,Is there a doctor's office nearby?
Inquiry,What's the best way to contact you?
Inquiry,Could you recommend a good restaurant?
Inquiry,Do you accept credit cards here?
Inquiry,What's the weather forecast for tomorrow?
Inquiry,Can you check if my package has arrived?
Inquiry,Where can I get a taxi around here?
Inquiry,What's the WiFi password?
Inquiry,What's your policy on refunds?
Inquiry,How do I access my account?
Inquiry,What are your business hours?
Inquiry,Could you help me with this application?
Inquiry,Is there a discount available?
Inquiry,Where can I find more information?
Inquiry,What are the terms and conditions?
Inquiry,Do you offer delivery services?
Inquiry,Can you recommend a good book?
Inquiry,How can I update my profile?
Inquiry,What's the price for this service?
Inquiry,Where can I park my car?
